pipeline_output/Karrer et al_params.json

{
    "blood_flow_fraction": {},
    "volume_fraction": {
        "Glucuronides/Sulfates (serum)": 0.0435
    },
    "biochemical_parameters": {
        "tissue_serum_partition_coefficients": {
            "Liver": {
                "BPA": 0.73,
                "BPS": 0.846,
                "BPF": 0.872,
                "BPAF": 2.44
            },
            "Slowly_perfused_tissue": {
                "BPA": 2.7,
                "BPS": 0.881,
                "BPF": 0.853,
                "BPAF": 2.11
            },
            "Brain": {
                "BPA": 2.8,
                "BPS": 0.81,
                "BPF": 0.745,
                "BPAF": 2.04
            },
            "Richly_perfused_tissue": {
                "BPA": 2.8,
                "BPS": 0.81,
                "BPF": 0.745,
                "BPAF": 2.04
            },
            "Fat": {
                "BPA": 5.0,
                "BPS": 0.435,
                "BPF": 0.884,
                "BPAF": 5.73
            },
            "Skin": {
                "BPA": 2.15,
                "BPS": 0.915,
                "BPF": 1.09,
                "BPAF": 3.26
            },
            "Gonads": {
                "BPA": 2.6,
                "BPS": 0.843,
                "BPF": 0.778,
                "BPAF": 1.86
            }
        },
        "hepatic_glucuronidation": {
            "BPA": {
                "Km_nM": 45800,
                "Ksi_nM": 219000,
                "vmax_nmol_per_h_per_g_liver": 9040
            },
            "BPS": {
                "Km_nM": 446000,
                "vmax_nmol_per_h_per_g_liver": 7810
            },
            "BPF": {
                "Km_nM": 17900,
                "vmax_nmol_per_h_per_g_liver": 3600
            },
            "BPAF": {
                "Km_nM": 4210,
                "vmax_nmol_per_h_per_g_liver": 5660
            },
            "microsomal_protein_liver_mg_per_g": 32.0
        },
        "intestinal_glucuronidation": {
            "BPA": {
                "Km_nM": 58400,
                "vmax_nmol_per_h_per_g_bw": 361
            },
            "BPS": {
                "Km_nM": 555000,
                "Ksi_nM": 711000
            },
            "BPF": {
                "Ksi_nM": 605000
            },
            "BPAF": {
                "Km_nM": 1830,
                "Ksi_nM": 82200
            },
            "microsomal_protein_small_intestine_mg_per_kg_bw": 4.29
        },
        "hepatic_sulfation": {
            "BPA": {
                "Km_nM": 10100,
                "vmax_nmol_per_h_per_g_liver": 149
            },
            "BPS": "approximated from BPA",
            "BPF": "approximated from BPA",
            "BPAF": "approximated from BPA"
        },
        "gastric_emptying_1_per_h_per_kgBW_m0.25": 3.5,
        "volume_of_distribution_small_intestine_mL": 122,
        "oral_uptake_small_intestine_to_liver_1_per_h_per_kgBW_m0.25": {
            "BPA": 2.1,
            "BPS": 5.0,
            "BPF": 2.1,
            "BPAF": 5.0
        },
        "urinary_excretion_1_per_h_per_kgBW_0.75": {
            "BPA": 0.06,
            "BPS": 0.3,
            "BPF": 0.06,
            "BPAF": 0.3
        },
        "fraction_glucuronide_liver_to_serum_no_EHR": {
            "BPA": 0.9,
            "BPS": 0.33,
            "BPF": 1.0,
            "BPAF": 0.3
        },
        "EHR_unconjugated_1_per_h_per_kgBW_m0.25": {
            "BPA": 0.2,
            "BPS": 0.35,
            "BPF": 0.2,
            "BPAF": 0.35
        },
        "EHR_as_glucuronide_1_per_h_per_kgBW_m0.25": {
            "BPA": 0.2,
            "BPS": 2.0,
            "BPF": 0.2,
            "BPAF": 2.0
        },
        "uptake_enterocytes_to_liver_gluc_sulf_1_per_h_per_kgBW_m0.25": 50.0,
        "urinary_excretion_glucuronide_1_per_h_per_kgBW_0.75": {
            "BPA": 0.35,
            "BPS": 1.2,
            "BPF": 0.35,
            "BPAF": 1.2
        },
        "urinary_excretion_sulfate_1_per_h_per_kgBW_0.75": 0.03,
        "peroral_absorption_fraction": 1.0,
        "peroral_uptake_period_h": 0.25,
        "dermal_thermal_paper_absorption_fraction": 0.2,
        "dermal_thermal_paper_absorption_half_life_h": 6.0,
        "dermal_thermal_paper_uptake_period_h": 24.0,
        "dermal_PCPs_absorption_fraction": 0.6,
        "dermal_PCPs_absorption_half_life_h": 0.167,
        "dermal_PCPs_uptake_period_h": 24.0
    },
    "equations": {
        "Michaelis_Menten": "v = (vmax * [S]) / (Km + [S])",
        "Substrate_inhibition": "v = (vmax * [S]) / (Km + [S]) * (1 + [S]/Ksi)",
        "MRD": "MRD = 10 * sqrt( sum(log10(predicted) - log10(observed))^2 / n )",
        "AFE": "AFE = 10 * ( sum(log10(predicted) - log10(observed)) / n )"
    }
}

pipeline_output/Karrer et al_cleaned.md

al. (2002). Note: PBPK, physiologically based pharmacokinetic; PCPs, personal care products; TP, thermal paper. 077002-5 deviation from the values measured in vitro). We did not quantify
uncertainty for the glucuronidation of BPAF in the small intes-
tine, because four measurement points were within the concentra-
tion range of our model, so that the kinetics are likely to be less
uncertain.
For the peroral uptake of BPF and BPAF from the small intes-
tine to the liver and their urinary excretion rates, the values from
the calibrated BPA and BPS models were used as boundaries, to
take into account possible deviations after model calibration.
For the hepatic sulfation kinetics of BPS, BPF, and BPAF, the
vmax of BPA sulfation was multiplied with a correction factor
sampled from a distribution. The ﬁrst boundaries of the correction
factor distributions were the ratios between the hepatic glucuronida-
tion rate of BPA and of the other analogs at environmentally relevant
substrate concentrations. The second boundaries were the respective
reciprocal values. This way, we wanted to mirror hepatic sulfation
rates that are proportional or inversely proportional to the glucuroni-
dation rates. For BPF and BPAF, we determined these ratios both
with the original glucuronidation kinetics from our in vitro experi-
ments and with the kinetics adjusted to the ﬁndings for BPS from
in vivo data from Oh et al. (2018). We then used the outermost ratios
as boundaries.
For the fractions of BPA and BPS subject to EHR, we used
ranges of 20% around the EHR values that led to the best ﬁt to
the biomonitoring data, i.e., modes of 0–20% for BPA and 57–
77% for BPS. For BPF and BPAF, we used wider ranges and var-
ied the EHR rates of unconjugated substances and glucuronides
in the uncertainty loops (for BPA and BPS, we varied them only
in the variability loops).
Diﬀerent studies investigated the microsomal protein content
in the liver (Barter et al. 2007; Pelkonen et al. 1973; Schoene et al.
1972) and the small intestine (Paine et al. 1997; Zhang et al.
1999), and we set up distributions accordingly.
Diﬀerent values have been reported for the extent of dermal
absorption and its half-life (Biedermann et al. 2010; Demierre
et al. 2012; Toner et al. 2016; Zalko et al. 2011). For thermal pa-
per, we considered only studies in which BPA was dissolved in
water or in sweat simulants, whereas for PCPs, we considered all
studies available regardless of the solvent used.
Variability: We used normal distributions if not indicated
otherwise. The age was sampled from a uniform distribution
across the deﬁned age group range (18–45). We used height
distributions for adults with the respective SDs (CV of 6%) to
represent the Central European population (Motmans 2005).
For the body mass index (BMI), we used a log-normal distribu-
tion based on a CV of 20%, because a right-skewed BMI-
distribution had been found for the Belgian adult population
(Lebacq 2015).
Furthermore, we used a CV of 23% for the cardiac output
(Squara et al. 2007), 32% for the PTS (Doerge et al. 2011), and
27% for the organ blood ﬂows (Brown et al. 1997). We used a
CV of 25% for the tissue volumes (Henderson et al. 1981), which
we also used for the volume of distribution in the small intestine
(educated guess). To maintain mass balance and to ensure that
the sampled physiological parameters are physiologically plausi-
ble, we readjusted the sum of the randomly sampled organ blood
ﬂows and tissue volumes in a fractional manner. For this, we cal-
culated the deviations of the total sampled blood ﬂows and tissue
volumes from the required sums, respectively. We then corrected
for the deviated amount in proportion to the respective mean frac-
tional blood ﬂows and tissue volumes.
Kuester and Sipes (2007) investigated interindividual diﬀer-
ences in hepatic glucuronidation, and we derived CVs of 29% for
the Km and 36% for the vmax from their ﬁndings. We also used
these values for Km and vmax of the other metabolism pathways,
as there were no ranges available for hepatic sulfation, and only
pooled microsomes had been used in the studies investigating gut
glucuronidation. For the Ksi, we derived a CV of 33% from the
results of our experiments on gut and hepatic glucuronidation.
However, this CV does not fully reﬂect interindividual variabili-
ty, but rather a mixture of variability and measurement uncer-
tainty, because we used pooled microsomes.
We used CVs of 40% and 6% for the microsomal protein con-
tent in the small intestine (Paine et al. 1997; Zhang et al. 1999)
and the liver (Barter et al. 2007; Pelkonen et al. 1973; Schoene
et al. 1972), respectively. For the gastric emptying time, we
derived a CV of 27% from a study measuring gastric emptying
rates with varying peroral doses (Oberle et al. 1990). The CV for
the peroral uptake from the small intestine to the liver was set to
39% (Yu et al. 1996).
We used CVs of 31% for the dermal absorption fractions
(Toner et al. 2016) and 30% for the dermal absorption half-lives
(educated guess). We did not vary the peroral absorption frac-
tion of 100%, which is recommended for use in regulatory risk
assessments [EU (European Union) 2008], as this would only
lower the model estimates, and we did not want to trigger
underestimation in the variability assessment. CVs of 30% were
used for the uptake of BPA-g and BPA-s from the enterocytes
into the liver, the urinary excretion of BPA, BPA-g, and BPA-s,
and the EHR conversion rates from unconjugated and glucuron-
ized substances (educated guess).
Model Evaluation – Comparison with Biomonitoring Data
To evaluate the model, we sought to compare it with biomonitor-
ing data from literature that were independent of the data the ba-
sic models were calibrated with. Studies could be used only if
they reported concentrations and time-points of exposure, as well
as time-dependent and conclusive internal concentration proﬁles.
Such data to date are available only for BPA: Teeguarden et al.
(2015) recruited ten healthy male adults and provided them with
tomato soup that contained 30 lg deuterated BPA/kg BW.
Within the 24-h study period, venous blood samples were drawn,
and all voided urine was collected. In our PBPK model, we used
the volunteers’ individual physiological parameters and BW-
speciﬁc single peroral exposures.
Hormann et al. (2014) let volunteers wet their hands with
hand sanitizer before they held thermal receipt paper containing
BPA. Subsequently, the subjects ate 10 French fries with the con-
taminated hands, resulting in both dermal and peroral exposure to
BPA. We compared the individual systemic serum proﬁles of
BPA, BPA-g, and BPA-s measured in three volunteers with our
Table 6. PTS for BPA (Doerge et al. 2011; Zhang and Zhang 2006) and
BPS, BPF, and BPAF (Zhang and Zhang 2006).
Tissue
BPA
BPSa
BPFb
0.730
0.846
0.872
2.44
Slowly perfused tissuec
2.70
0.881
0.853
2.11
Brain
2.80
0.810
0.745
2.04
Richly perfused tissued
2.80
0.810
0.745
2.04
Fat
5.00
0.435
0.884
5.73
Skin
2.15
0.915
1.09
3.26
2.60
0.843
0.778
1.86
aCalculated as 14% deprotonated.
bCalculated as 40% deprotonated.
cPerfusion lower than 0:1 mL=min=g tissue: muscle and skeleton (Edginton et al. 2006;
ICRP 2002).
dPerfusion higher than 0:1 mL=min=g tissue: heart, kidneys, small and large intestine,
pancreas, spleen, and stomach (Edginton et al. 2006; ICRP 2002).
Note: Please note that the citation Zhang and Zhang (2006) refers to their second QSAR
(equation 6). For BPA, no in vivo PTS was available for the skin compartment.
Therefore this PTS was calculated according to Zhang and Zhang (2006). BPA, bisphe-
nol A; BPAF, bisphenol AF; BPF, bisphenol F; BPS, bisphenol S; PTS, tissue/serum par-
tition coefficients; QSAR, quantitative structure-activity relationship.
077002-6